[
 {
  "id": "FIG-WDS-001",
  "pool": "core",
  "series": "figures.elders",
  "type": "key",
  "title": "文德嗣递章程",
  "source": {
   "kind": "force",
   "id": "council",
   "name": "扩大会议"
  },
  "tags": [
   "元老",
   "政治"
  ],
  "requires": [
   {
    "day": {
     "gte": 16
    }
   }
  ],
  "excludes": [],
  "weight": 24,
  "options": {
   "left": {
    "id": "shou_xia",
    "label": "照此办。",
    "hint": "章程压得住台面，也压得住人心",
    "effects": {
     "stats": {
      "council": 4
     },
     "personal": {
      "faction_alarm": -2
     },
     "states": [
      {
       "id": "series.figures_elders",
       "op": "add",
       "value": 1
      }
     ]
    }
   },
   "right": {
    "id": "gai_yi_gai",
    "label": "再改改。",
    "hint": "头一个章程，得没有一处含糊",
    "effects": {
     "stats": {
      "council": 2
     },
     "personal": {
      "faction_alarm": 1
     },
     "states": [
      {
       "id": "series.figures_elders",
       "op": "add",
       "value": 1
      }
     ]
    }
   }
  },
  "lines": [
   {
    "who": "文德嗣",
    "line": "执政者，会议的章程我誊清了。谁提议、谁附议、几票成案，白纸黑字。往后咱们吵架，也得吵得有规矩。"
   },
   {
    "who": "文德嗣",
    "line": "只有一句话我不许改：大会的代表权，归穿越众全体，不归哪一个口。"
   }
  ]
 },
 {
  "id": "FIG-WDS-002",
  "pool": "core",
  "series": "figures.elders",
  "type": "daily",
  "title": "文德嗣的周报",
  "source": {
   "kind": "force",
   "id": "council",
   "name": "扩大会议"
  },
  "tags": [
   "元老",
   "政治"
  ],
  "requires": [
   {
    "used": "FIG-WDS-001"
   }
  ],
  "excludes": [],
  "weight": 16,
  "options": {
   "left": {
    "id": "pi_yue",
    "label": "逐条批。",
    "hint": "他写的每一条，都是替你挡过的刀",
    "effects": {
     "stats": {
      "council": 2
     },
     "days": 1,
     "states": [
      {
       "id": "series.figures_elders",
       "op": "add",
       "value": 1
      }
     ]
    }
   },
   "right": {
    "id": "shu_lve",
    "label": "挑要紧的。",
    "hint": "时间要花在刀刃上",
    "effects": {
     "stats": {
      "council": 1
     },
     "states": [
      {
       "id": "series.figures_elders",
       "op": "add",
       "value": 1
      }
     ]
    }
   }
  },
  "lines": [
   {
    "who": "文德嗣",
    "line": "周报送来了。十件事，我按轻重排过：头一件是粮，末一件还是粮。中间那八件，您扫一眼就成——别让案牍把人淹了。"
   }
  ]
 },
 {
  "id": "FIG-WDS-003",
  "pool": "core",
  "series": "figures.elders",
  "type": "crisis",
  "title": "文德嗣的调解",
  "source": {
   "kind": "force",
   "id": "council",
   "name": "扩大会议"
  },
  "tags": [
   "元老",
   "政治"
  ],
  "requires": [
   {
    "used": "FIG-WDS-002"
   }
  ],
  "excludes": [],
  "weight": 20,
  "options": {
   "left": {
    "id": "mai_mian",
    "label": "给他面子。",
    "hint": "主席的面子，就是大会的里子",
    "effects": {
     "stats": {
      "council": 3
     },
     "personal": {
      "faction_alarm": -3
     },
     "states": [
      {
       "id": "series.figures_elders",
       "op": "add",
       "value": 1
      }
     ]
    }
   },
   "right": {
    "id": "dang_mian_pi",
    "label": "当面驳回。",
    "hint": "调解可以，和稀泥不行",
    "effects": {
     "stats": {
      "council": -2
     },
     "personal": {
      "faction_alarm": 2,
      "violence_risk": 1
     },
     "states": [
      {
       "id": "series.figures_elders",
       "op": "add",
       "value": 1
      }
     ]
    }
   }
  },
  "lines": [
   {
    "who": "文德嗣",
    "line": "民政口和计委在排期会上拍了桌子，我压了一晚上。给您递个话：各让一步，排期照计委的，人手照民政的——您点个头，这事就翻篇。"
   },
   {
    "who": "文德嗣",
    "line": "您要不点头……我这个主席，往后说话就不值钱了。"
   }
  ]
 },
 {
  "id": "FIG-WDS-004",
  "pool": "core",
  "series": "figures.elders",
  "type": "backlash",
  "title": "文德嗣的疲惫",
  "source": {
   "kind": "force",
   "id": "council",
   "name": "扩大会议"
  },
  "tags": [
   "元老",
   "政治"
  ],
  "requires": [
   {
    "used": "FIG-WDS-003"
   }
  ],
  "excludes": [],
  "weight": 16,
  "options": {
   "left": {
    "id": "fang_jia",
    "label": "放他十天假。",
    "hint": "机器也得歇，何况是人",
    "effects": {
     "stats": {
      "council": -1
     },
     "states": [
      {
       "id": "series.figures_elders",
       "op": "add",
       "value": 1
      }
     ]
    }
   },
   "right": {
    "id": "xu_yi_xu",
    "label": "再撑撑。",
    "hint": "这时候换谁都接不上",
    "effects": {
     "stats": {
      "council": 2
     },
     "personal": {
      "faction_alarm": 1
     },
     "states": [
      {
       "id": "series.figures_elders",
       "op": "add",
       "value": 1
      }
     ]
    }
   }
  },
  "lines": [
   {
    "who": "值班秘书",
    "line": "文主席三天没出办公室了，灯亮到后半夜。今早递出来的条子只有一句话：近来诸事丛集，精神有不济之感，乞假数日，另行选贤。"
   },
   {
    "who": "值班秘书",
    "line": "下面的人都在看——主席要是倒了，大会那杆秤还给不给得出分量。"
   }
  ]
 },
 {
  "id": "FIG-MQZ-001",
  "pool": "core",
  "series": "figures.elders",
  "type": "key",
  "title": "马千瞩的对表会",
  "source": {
   "kind": "force",
   "id": "planning",
   "name": "计划委员会"
  },
  "tags": [
   "元老",
   "计划"
  ],
  "requires": [
   {
    "day": {
     "gte": 18
    }
   }
  ],
  "excludes": [],
  "weight": 24,
  "options": {
   "left": {
    "id": "dui_biao",
    "label": "开对表会。",
    "hint": "所有的钟，对成一座钟",
    "effects": {
     "stats": {
      "livelihood": 3,
      "council": -1
     },
     "forces": {
      "planning": {
       "influence": 5
      }
     },
     "states": [
      {
       "id": "series.figures_elders",
       "op": "add",
       "value": 1
      }
     ]
    }
   },
   "right": {
    "id": "ge_kou_gan",
    "label": "各口自便。",
    "hint": "条条大路通百仞，何必都走一条",
    "effects": {
     "stats": {
      "council": 1
     },
     "personal": {
      "faction_alarm": -1
     },
     "states": [
      {
       "id": "series.figures_elders",
       "op": "add",
       "value": 1
      }
     ]
    }
   }
  },
  "lines": [
   {
    "who": "马千瞩",
    "line": "执政者，我在计委立了个规矩：每月初一，各口来对表——不是对钟表，是对进度。钢几吨、糖几篓、药几瓶，报不上实数的，当场说清楚。"
   },
   {
    "who": "马千瞩",
    "line": "有人说这是拿算盘管人。我说，算盘不认人，所以它比人公道。"
   }
  ]
 },
 {
  "id": "FIG-MQZ-002",
  "pool": "core",
  "series": "figures.elders",
  "type": "daily",
  "title": "马千瞩砍预算",
  "source": {
   "kind": "force",
   "id": "planning",
   "name": "计划委员会"
  },
  "tags": [
   "元老",
   "计划"
  ],
  "requires": [
   {
    "used": "FIG-MQZ-001"
   }
  ],
  "excludes": [],
  "weight": 18,
  "options": {
   "left": {
    "id": "zhun_kan",
    "label": "准砍。",
    "hint": "省下的就是赚下的",
    "effects": {
     "stats": {
      "livelihood": 3,
      "council": -2
     },
     "forces": {
      "planning": {
       "influence": 3
      }
     },
     "states": [
      {
       "id": "series.figures_elders",
       "op": "add",
       "value": 1
      }
     ]
    }
   },
   "right": {
    "id": "bo_hui",
    "label": "驳回去。",
    "hint": "钱是花出来的，不是省出来的",
    "effects": {
     "stats": {
      "livelihood": -1,
      "council": 2
     },
     "personal": {
      "faction_alarm": 1
     },
     "states": [
      {
       "id": "series.figures_elders",
       "op": "add",
       "value": 1
      }
     ]
    }
   }
  },
  "lines": [
   {
    "who": "马千瞩",
    "line": "各口的预算书我砍了三成本。保卫组要的军械、民政要的口粮、工口要的焦炭，我都留了——砍掉的是排场：新楼、新服、新家具。"
   },
   {
    "who": "马千瞩",
    "line": "有人骂我抠。等粮价再涨一回，他们就知道我抠得对不对。"
   }
  ]
 },
 {
  "id": "FIG-MQZ-003",
  "pool": "core",
  "series": "figures.elders",
  "type": "crisis",
  "title": "马千瞩的坏消息",
  "source": {
   "kind": "force",
   "id": "planning",
   "name": "计划委员会"
  },
  "tags": [
   "元老",
   "计划"
  ],
  "requires": [
   {
    "used": "FIG-MQZ-002"
   }
  ],
  "excludes": [],
  "weight": 20,
  "options": {
   "left": {
    "id": "ting_ta_suan",
    "label": "听他算完。",
    "hint": "他递来的坏消息，从来都是真的",
    "effects": {
     "stats": {
      "livelihood": 2
     },
     "wind": 1,
     "days": 1,
     "states": [
      {
       "id": "series.figures_elders",
       "op": "add",
       "value": 1
      }
     ]
    }
   },
   "right": {
    "id": "bu_xiang_ting",
    "label": "不许再报。",
    "hint": "报忧的嘴堵住了，忧还在",
    "effects": {
     "stats": {
      "livelihood": -2
     },
     "personal": {
      "faction_alarm": 2
     },
     "states": [
      {
       "id": "series.figures_elders",
       "op": "add",
       "value": 1
      }
     ]
    }
   }
  },
  "lines": [
   {
    "who": "马千瞩",
    "line": "执政者，三张表我都重算了一遍：照现在的消耗，糖和盐的进项撑不过五十天。缺口两千三百两。"
   },
   {
    "who": "马千瞩",
    "line": "我有三个补法，一个比一个得罪人。您听完再选，别听完就骂。"
   }
  ]
 },
 {
  "id": "FIG-MQZ-004",
  "pool": "core",
  "series": "figures.elders",
  "type": "benefit",
  "title": "马千瞩的报表",
  "source": {
   "kind": "force",
   "id": "planning",
   "name": "计划委员会"
  },
  "tags": [
   "元老",
   "计划"
  ],
  "requires": [
   {
    "used": "FIG-MQZ-003"
   }
  ],
  "excludes": [],
  "weight": 16,
  "options": {
   "left": {
    "id": "zhang_bang",
    "label": "张榜公布。",
    "hint": "数字见人，人心才定",
    "effects": {
     "stats": {
      "people": 3,
      "council": 1
     },
     "wind": 1,
     "states": [
      {
       "id": "series.figures_elders",
       "op": "add",
       "value": 1
      }
     ]
    }
   },
   "right": {
    "id": "nei_chuan",
    "label": "内部传阅。",
    "hint": "数字出了营地，就是行情",
    "effects": {
     "stats": {
      "council": 1
     },
     "states": [
      {
       "id": "series.figures_elders",
       "op": "add",
       "value": 1
      }
     ]
    }
   }
  },
  "lines": [
   {
    "who": "马千瞩",
    "line": "这个月的表做完了：糖三百一十七篓、盐二百六十石、罐头八千二百听，进出两抵，净余四百两——头一回，账是黑字。"
   },
   {
    "who": "马千瞩",
    "line": "要不要贴出去？贴了，人心稳；也贴给了广商和官府——咱们的家底。"
   }
  ]
 },
 {
  "id": "FIG-XZS-001",
  "pool": "core",
  "series": "figures.elders",
  "type": "daily",
  "title": "萧子山的条陈",
  "source": {
   "kind": "force",
   "id": "council",
   "name": "扩大会议"
  },
  "tags": [
   "元老",
   "秘书"
  ],
  "requires": [
   {
    "day": {
     "gte": 20
    }
   }
  ],
  "excludes": [],
  "weight": 16,
  "options": {
   "left": {
    "id": "zhao_ban",
    "label": "照办。",
    "hint": "他把你要想的都替你想了",
    "effects": {
     "stats": {
      "council": 2
     },
     "states": [
      {
       "id": "series.figures_elders",
       "op": "add",
       "value": 1
      }
     ]
    }
   },
   "right": {
    "id": "jianban",
    "label": "拣一半。",
    "hint": "全听秘书的，首长成了谁",